{
 "$schema": "https://sustainableurbansystems.com/CFD-Test-Cases-Architectural-Institute-of-Japan-AIJ/api/schemas/cases.schema.json",
 "schema_version": "2.1.0",
 "data_version": "5af8c81571e452c1925b3efe58c698908066f64886eba5efd9b2f0348ecdc019",
 "license": "CC-BY-4.0",
 "cases": [
  {
   "id": "A",
   "slug": "case-a",
   "title": "Case A — 1:1:2 building",
   "summary": "Isolated 1:1:2 building, velocity field (split-fibre hot wire).",
   "configuration": {
    "building": "1:1:2 (width : depth : height) prism",
    "b_m": 0.08,
    "H_m": 0.16,
    "Re_H": 24000,
    "U_H_m_s": 4.491,
    "wind_directions_deg": [
     0
    ],
    "measurement_planes": [
     "vertical centre plane y/b = 0",
     "horizontal z/b = 0.125",
     "horizontal z/b = 1.25"
    ],
    "instrument": "hot-wire anemometer, split-fibre probes (DANTEC 55R55 streamwise, 55R57 spanwise/vertical), 1000 Hz, 60 s per point, 500 Hz low-pass",
    "tunnel": "Technical Research Institute, Shimizu Corporation, Tokyo",
    "scale_note": "model scale; Eddy3D solves it at 1:100 (b = 8 m, H = 16 m) with the tunnel velocities"
   },
   "quantities": [
    "U",
    "V",
    "W",
    "uu",
    "vv",
    "ww",
    "k"
   ],
   "units": {
    "length": "m (model scale)",
    "velocity": "m/s",
    "variance": "m^2/s^2",
    "k": "m^2/s^2"
   },
   "frame": {
    "origin": "building centre on the ground plane",
    "x": "+x streamwise (the wind at WD = 0 blows toward +x); building spans x in [-0.04, 0.04]",
    "y": "+y lateral; building spans y in [-0.04, 0.04]; points published on the y <= 0 half by the tunnel's symmetry convention",
    "z": "+z up from the ground; roof at z = 0.16"
   },
   "counts": {
    "rows": 186,
    "distinct_points": 186,
    "configurations": 1
   },
   "engines": {
    "openfoam12-realizableKE": "scored",
    "openlb": "scored",
    "fluidx3d": "scored",
    "ml-surrogate": "scored"
   },
   "doi": "10.5281/zenodo.15050147",
   "links": {
    "case": "https://sustainableurbansystems.com/CFD-Test-Cases-Architectural-Institute-of-Japan-AIJ/api/cases/A.json",
    "points": "https://sustainableurbansystems.com/CFD-Test-Cases-Architectural-Institute-of-Japan-AIJ/api/cases/A/points.json",
    "points_csv": "https://sustainableurbansystems.com/CFD-Test-Cases-Architectural-Institute-of-Japan-AIJ/api/cases/A/points.csv?v=eb21b9a8ffd3",
    "geometry": "https://sustainableurbansystems.com/CFD-Test-Cases-Architectural-Institute-of-Japan-AIJ/api/cases/A/geometry.json",
    "geometry_stl": "https://sustainableurbansystems.com/CFD-Test-Cases-Architectural-Institute-of-Japan-AIJ/api/cases/A/geometry.stl?v=89acdfbbff84",
    "validation": "https://sustainableurbansystems.com/CFD-Test-Cases-Architectural-Institute-of-Japan-AIJ/api/cases/A/validation.json",
    "page": "https://sustainableurbansystems.com/CFD-Test-Cases-Architectural-Institute-of-Japan-AIJ/cases/case-a/",
    "render": "https://sustainableurbansystems.com/CFD-Test-Cases-Architectural-Institute-of-Japan-AIJ/assets/geometry/case-a.png"
   }
  },
  {
   "id": "B",
   "slug": "case-b",
   "title": "Case B — 1:4:4 slab",
   "summary": "Isolated 1:4:4 slab, velocity field (split-fibre hot wire).",
   "configuration": {
    "building": "1:4:4 (depth : width : height) slab",
    "depth_m": 0.05,
    "width_m": 0.2,
    "H_m": 0.2,
    "Re_H": 72000,
    "U_H_m_s": 5.133,
    "wind_directions_deg": [
     0
    ],
    "measurement_planes": [
     "vertical centre plane y/H = 0",
     "horizontal z/H = 1/16"
    ],
    "instrument": "hot-wire anemometer, split-fibre probe, 100 Hz, 60 s per point",
    "tunnel": "Niigata Institute of Technology, Kashiwazaki",
    "scale_note": "model scale; Eddy3D solves it at 1:100 (H = 20 m) with the tunnel velocities"
   },
   "quantities": [
    "U",
    "V",
    "W",
    "uu",
    "vv",
    "ww",
    "k"
   ],
   "units": {
    "length": "m (model scale; converted from the published millimetres)",
    "velocity": "m/s",
    "variance": "m^2/s^2",
    "k": "m^2/s^2"
   },
   "frame": {
    "origin": "building centre on the ground plane",
    "x": "+x streamwise (the wind at WD = 0 blows toward +x); slab spans x in [-0.025, 0.025]",
    "y": "+y lateral; slab spans y in [-0.10, 0.10]; points published on the y <= 0 half by the tunnel's symmetry convention",
    "z": "+z up from the ground; roof at z = 0.20"
   },
   "counts": {
    "rows": 224,
    "distinct_points": 224,
    "configurations": 1
   },
   "engines": {
    "openfoam12-realizableKE": "scored",
    "openlb": "scored",
    "fluidx3d": "scored",
    "ml-surrogate": "scored"
   },
   "doi": "10.5281/zenodo.15401455",
   "links": {
    "case": "https://sustainableurbansystems.com/CFD-Test-Cases-Architectural-Institute-of-Japan-AIJ/api/cases/B.json",
    "points": "https://sustainableurbansystems.com/CFD-Test-Cases-Architectural-Institute-of-Japan-AIJ/api/cases/B/points.json",
    "points_csv": "https://sustainableurbansystems.com/CFD-Test-Cases-Architectural-Institute-of-Japan-AIJ/api/cases/B/points.csv?v=e8214b704821",
    "geometry": "https://sustainableurbansystems.com/CFD-Test-Cases-Architectural-Institute-of-Japan-AIJ/api/cases/B/geometry.json",
    "geometry_stl": "https://sustainableurbansystems.com/CFD-Test-Cases-Architectural-Institute-of-Japan-AIJ/api/cases/B/geometry.stl?v=e6de70eeb17d",
    "validation": "https://sustainableurbansystems.com/CFD-Test-Cases-Architectural-Institute-of-Japan-AIJ/api/cases/B/validation.json",
    "page": "https://sustainableurbansystems.com/CFD-Test-Cases-Architectural-Institute-of-Japan-AIJ/cases/case-b/",
    "render": "https://sustainableurbansystems.com/CFD-Test-Cases-Architectural-Institute-of-Japan-AIJ/assets/geometry/case-b.png"
   }
  },
  {
   "id": "C",
   "slug": "case-c",
   "title": "Case C — 3 × 3 block array",
   "summary": "3 x 3 array of 0.20 m cubes, centre block at 0D / 1D / 2D, pedestrian-height scalar speed (thermistor), 3 wind directions.",
   "configuration": {
    "array": "3 x 3 cubes, D = 0.20 m, block centres at x, y in {-0.4, 0, +0.4} m (pitch 0.40 m = 2D, street width D)",
    "D_m": 0.2,
    "centre_building": {
     "0D": "no centre building",
     "1D": "0.2 x 0.2 x 0.2 m (same as the surroundings)",
     "2D": "0.2 x 0.2 x 0.4 m"
    },
    "wind_directions_deg": [
     0,
     22.5,
     45
    ],
    "configurations": 9,
    "configurations_note": "3 centre-building heights x 3 wind directions; all nine share the identical 120-point set",
    "measurement_height_m": 0.02,
    "measurement_height_note": "z = 0.1 D for every point (2.0 m at the 1:100 scale Eddy3D solves it at)",
    "Re_D": 52000,
    "U_H_m_s": 3.654,
    "U_H_note": "U at z = D = 0.20 m from AF_caseC.csv; the data paper states U_H = 3.65 m/s",
    "instrument": "thermistor anemometer (omnidirectional scalar speed), 1 Hz, 30 s per point; approach flow by I-type hot wire, 500 Hz, 30 s",
    "tunnel": "Technology Development Division, Fujita Corporation, Tokyo",
    "pitch_note": "The 0.40 m pitch is read from MP-z-caseC.png and Figure 3 of the data paper (street = D); the 120-point grid alone bounds the pitch to (0.35, 0.40] m (the 49 absent nodes of the 13 x 13 grid are exactly the nine footprints for 0.375 m as well as 0.40 m)."
   },
   "quantities": [
    "Vs"
   ],
   "units": {
    "length": "m (model scale)",
    "velocity": "m/s"
   },
   "frame": {
    "origin": "array centre on the ground plane (centre of the middle block)",
    "x": "+x streamwise at WD = 0 (checked three ways on the data: y -> -y is a symmetry, the x <= -0.25 band is faster than x >= +0.25 in every configuration, and the regression slope of Vs is most negative within 0.8-4.3 deg of +x)",
    "y": "+y lateral",
    "z": "+z up; all points at z = 0.02"
   },
   "counts": {
    "rows": 1080,
    "distinct_points": 120,
    "configurations": 9
   },
   "engines": {
    "openfoam12-realizableKE": "scored",
    "openlb": "not comparable",
    "fluidx3d": "not comparable",
    "ml-surrogate": "scored"
   },
   "doi": "10.5281/zenodo.15401791",
   "links": {
    "case": "https://sustainableurbansystems.com/CFD-Test-Cases-Architectural-Institute-of-Japan-AIJ/api/cases/C.json",
    "points": "https://sustainableurbansystems.com/CFD-Test-Cases-Architectural-Institute-of-Japan-AIJ/api/cases/C/points.json",
    "points_csv": "https://sustainableurbansystems.com/CFD-Test-Cases-Architectural-Institute-of-Japan-AIJ/api/cases/C/points.csv?v=8cfc37fcec93",
    "geometry": "https://sustainableurbansystems.com/CFD-Test-Cases-Architectural-Institute-of-Japan-AIJ/api/cases/C/geometry.json",
    "geometry_stl": "https://sustainableurbansystems.com/CFD-Test-Cases-Architectural-Institute-of-Japan-AIJ/api/cases/C/geometry.stl?v=b8c31c57c453",
    "validation": "https://sustainableurbansystems.com/CFD-Test-Cases-Architectural-Institute-of-Japan-AIJ/api/cases/C/validation.json",
    "page": "https://sustainableurbansystems.com/CFD-Test-Cases-Architectural-Institute-of-Japan-AIJ/cases/case-c/",
    "render": "https://sustainableurbansystems.com/CFD-Test-Cases-Architectural-Institute-of-Japan-AIJ/assets/geometry/case-c-2d.png"
   }
  },
  {
   "id": "D",
   "slug": "case-d",
   "title": "Case D — high-rise among city blocks",
   "summary": "1:1:4 tower in a regular array of 82 low blocks, pedestrian-height scalar speed (thermistor, 3 wind directions) plus a 33-point split-fibre velocity field at WD = 0.",
   "configuration": {
    "tower": "0.25H x 0.25H x H = 62.5 x 62.5 x 250 mm (1:1:4)",
    "H_m": 0.25,
    "blocks": "82 blocks of 0.4H x 0.4H x 0.1H = 100 x 100 x 25 mm",
    "roads": "0.1H / 0.2H / 0.3H = 25 / 50 / 75 mm; 9 columns in x (pitch alternating 175 / 150 mm), 11 rows in y (pitch 125 mm); corners cut by the turntable circle",
    "array_extent_m": {
     "x": [
      -0.7,
      0.7
     ],
     "y": [
      -0.675,
      0.675
     ],
     "z": [
      0,
      0.25
     ]
    },
    "scale": "1:400 (H = 100 m full scale; the 5 mm measurement plane = 2 m)",
    "Re_H": 110000,